{
 "relic_id": "MET-37458",
 "name": "Bottle with Bulbous Neck",
 "aliases": [],
 "dynasty": "不详",
 "dynasty_confidence": "low",
 "year_range": [
  1250,
  1450
 ],
 "category": "陶器",
 "material": "Terracotta",
 "dimensions": "H. 7 15/16 in. (20.1 cm)",
 "excavated_from": "",
 "collection": {
  "museum": "大都会艺术博物馆",
  "region": "北美洲",
  "inventory_no": "1987.420.3"
 },
 "summary": "Bottle。Thailand",
 "history": "",
 "interpretation": [],
 "images": [
  {
   "url": "https://images.metmuseum.org/CRDImages/as/original/1987_420_3.JPG",
   "license": "CC0",
   "credit": "The Metropolitan Museum of Art, CC0"
  }
 ],
 "source_url": "https://www.metmuseum.org/art/collection/search/37458",
 "license": "CC0",
 "tags": [],
 "related": [],
 "raw_ref": "raw/met/37458.json",
 "needs_review": true,
 "fetched_at": "2026-09-04",
 "updated_at": "2026-09-04"
}