{
 "relic_id": "MET-42536",
 "name": "Dish with Peony Scroll",
 "aliases": [],
 "dynasty": "明",
 "dynasty_confidence": "medium",
 "year_range": [
  1567,
  1633
 ],
 "category": "瓷器",
 "material": "Porcelain painted with cobalt blue under transparent glaze (Jingdezhen ware)",
 "dimensions": "H. 1 1/4 in. (3.2 cm); Diam. 6 in. (15.2 cm); Diam. of foot 3 1/4 in. (8.3 cm)",
 "excavated_from": "",
 "collection": {
  "museum": "大都会艺术博物馆",
  "region": "北美洲",
  "inventory_no": "17.118.11"
 },
 "summary": "Dish。China。Ming dynasty (1368–1644), Wanli mark and period (1573–1620)",
 "history": "",
 "interpretation": [],
 "images": [
  {
   "url": "https://images.metmuseum.org/CRDImages/as/original/DP-14609-078.jpg",
   "license": "CC0",
   "credit": "The Metropolitan Museum of Art, CC0"
  }
 ],
 "source_url": "https://www.metmuseum.org/art/collection/search/42536",
 "license": "CC0",
 "tags": [
  "食器",
  "植物"
 ],
 "related": [],
 "raw_ref": "raw/met/42536.json",
 "needs_review": false,
 "fetched_at": "2026-09-08",
 "updated_at": "2026-09-08"
}