{
 "relic_id": "MET-38970",
 "name": "Seated Ascetic, Deified King, Agni (The God of Fire)",
 "aliases": [],
 "dynasty": "不详",
 "dynasty_confidence": "low",
 "year_range": [
  150,
  350
 ],
 "category": "青铜器",
 "material": "Bronze",
 "dimensions": "H. 14 1/2 in. (36.8 cm); W. 6 9/16 in. (16.7 cm); D. 7 in. (17.8 cm)",
 "excavated_from": "",
 "collection": {
  "museum": "大都会艺术博物馆",
  "region": "北美洲",
  "inventory_no": "1984.499"
 },
 "summary": "Figure。India (Kaushambi, Uttar Pradesh)",
 "history": "",
 "interpretation": [],
 "images": [
  {
   "url": "https://images.metmuseum.org/CRDImages/as/original/DP155519.jpg",
   "license": "CC0",
   "credit": "The Metropolitan Museum of Art, CC0"
  }
 ],
 "source_url": "https://www.metmuseum.org/art/collection/search/38970",
 "license": "CC0",
 "tags": [
  "酒文化",
  "礼制"
 ],
 "related": [],
 "raw_ref": "raw/met/38970.json",
 "needs_review": true,
 "fetched_at": "2026-09-04",
 "updated_at": "2026-09-04"
}