{
 "relic_id": "MET-51752",
 "name": "The Hundred Horses",
 "aliases": [],
 "dynasty": "明",
 "dynasty_confidence": "medium",
 "year_range": [
  1368,
  1644
 ],
 "category": "杂器",
 "material": "Handscroll; ink and color on silk",
 "dimensions": "16 3/8 x 74 1/4 in. (41.6 x 188.6 cm)",
 "excavated_from": "",
 "collection": {
  "museum": "大都会艺术博物馆",
  "region": "北美洲",
  "inventory_no": "47.136.3"
 },
 "summary": "Handscroll。China。Ming dynasty (1368–1644)",
 "history": "",
 "interpretation": [],
 "images": [
  {
   "url": "https://images.metmuseum.org/CRDImages/as/original/DP203201_CRD.jpg",
   "license": "CC0",
   "credit": "The Metropolitan Museum of Art, CC0"
  }
 ],
 "source_url": "https://www.metmuseum.org/art/collection/search/51752",
 "license": "CC0",
 "tags": [
  "酒文化",
  "礼制",
  "动物"
 ],
 "related": [],
 "raw_ref": "raw/met/51752.json",
 "needs_review": false,
 "fetched_at": "2026-09-08",
 "updated_at": "2026-09-08"
}