{
 "relic_id": "CLE-1920-1504",
 "name": "Book Cover",
 "aliases": [],
 "dynasty": "清",
 "dynasty_confidence": "medium",
 "year_range": [
  1800,
  1899
 ],
 "category": "织绣",
 "material": "silk",
 "dimensions": "Overall: 20.4 x 12.7 cm (8 1/16 x 5 in.)",
 "excavated_from": "",
 "collection": {
  "museum": "克利夫兰艺术博物馆",
  "region": "北美洲",
  "inventory_no": "1920.1504"
 },
 "summary": "Book Cover, 1800s. China, 19th century. Silk; overall: 20.4 x 12.7 cm (8 1/16 x 5 in.). The Cleveland Museum of Art, General Income Fund, 1920.1504",
 "history": "",
 "interpretation": [],
 "images": [
  {
   "url": "https://openaccess-cdn.clevelandart.org/1920.1504/1920.1504_web.jpg",
   "license": "CC0",
   "credit": "The Cleveland Museum of Art, CC0"
  },
  {
   "url": "https://openaccess-cdn.clevelandart.org/1920.1504/1920.1504_print.jpg",
   "license": "CC0",
   "credit": "The Cleveland Museum of Art, CC0"
  },
  {
   "url": "https://openaccess-cdn.clevelandart.org/1920.1504/1920.1504_alt0_web.jpg",
   "license": "CC0",
   "credit": "The Cleveland Museum of Art, CC0"
  },
  {
   "url": "https://openaccess-cdn.clevelandart.org/1920.1504/1920.1504_alt1_web.jpg",
   "license": "CC0",
   "credit": "The Cleveland Museum of Art, CC0"
  }
 ],
 "source_url": "https://clevelandart.org/art/1920.1504",
 "license": "CC0",
 "tags": [
  "酒文化",
  "礼制",
  "服饰"
 ],
 "related": [],
 "raw_ref": "raw/cle/page_1000.json",
 "needs_review": false,
 "fetched_at": "2026-09-04",
 "updated_at": "2026-09-04"
}