{
 "relic_id": "CLE-1995-208",
 "name": "Wine Warmer (Jue)",
 "aliases": [],
 "dynasty": "商",
 "dynasty_confidence": "high",
 "year_range": [
  -1300,
  -1023
 ],
 "category": "陶器",
 "material": "pottery, tripod vessel with loop handle and rudimentary bowstring decoration",
 "dimensions": "Diameter: 13.4 cm (5 1/4 in.); Overall: 11.7 cm (4 5/8 in.)",
 "excavated_from": "",
 "collection": {
  "museum": "克利夫兰艺术博物馆",
  "region": "北美洲",
  "inventory_no": "1995.208"
 },
 "summary": "Wine Warmer (Jue), c. 1300–1023 BCE. China, Shang dynasty (c. 1600–c. 1046 BCE), Anyang phase (c. 1250–1046 BCE). Pottery, tripod vessel with loop handle and rudimentary bowstring decoration; diameter: 13.4 cm (5 1/4 in.); overall: 11.7 cm (4 5/8 in.). The Cleveland Museum of Art, John L. Severance ",
 "history": "",
 "interpretation": [],
 "images": [
  {
   "url": "https://openaccess-cdn.clevelandart.org/1995.208/1995.208_web.jpg",
   "license": "CC0",
   "credit": "The Cleveland Museum of Art, CC0"
  },
  {
   "url": "https://openaccess-cdn.clevelandart.org/1995.208/1995.208_print.jpg",
   "license": "CC0",
   "credit": "The Cleveland Museum of Art, CC0"
  },
  {
   "url": "https://openaccess-cdn.clevelandart.org/1995.208/1995.208_alt0_web.jpg",
   "license": "CC0",
   "credit": "The Cleveland Museum of Art, CC0"
  }
 ],
 "source_url": "https://clevelandart.org/art/1995.208",
 "license": "CC0",
 "tags": [
  "食器",
  "酒文化",
  "礼制",
  "动物"
 ],
 "related": [],
 "raw_ref": "raw/cle/page_2000.json",
 "needs_review": false,
 "fetched_at": "2026-09-04",
 "updated_at": "2026-09-04"
}