{
 "relic_id": "MET-41421",
 "name": "Snuff Bottle",
 "aliases": [],
 "dynasty": "清",
 "dynasty_confidence": "medium",
 "year_range": [
  1800,
  1899
 ],
 "category": "玻璃器",
 "material": "Sapphire with pink glass stopper",
 "dimensions": "H. 2 5/8 in. (6.7 cm)",
 "excavated_from": "",
 "collection": {
  "museum": "大都会艺术博物馆",
  "region": "北美洲",
  "inventory_no": "21.175.211a, b"
 },
 "summary": "Snuff bottle。China。Qing dynasty (1644–1911)",
 "history": "",
 "interpretation": [],
 "images": [
  {
   "url": "https://images.metmuseum.org/CRDImages/as/original/21_175_211ab_O1.jpg",
   "license": "CC0",
   "credit": "The Metropolitan Museum of Art, CC0"
  }
 ],
 "source_url": "https://www.metmuseum.org/art/collection/search/41421",
 "license": "CC0",
 "tags": [
  "日常生活"
 ],
 "related": [],
 "raw_ref": "raw/met/41421.json",
 "needs_review": false,
 "fetched_at": "2026-09-08",
 "updated_at": "2026-09-08"
}