{
 "relic_id": "MET-49055",
 "name": "Landscape",
 "aliases": [],
 "dynasty": "明",
 "dynasty_confidence": "medium",
 "year_range": [
  1634,
  1666
 ],
 "category": "金银器",
 "material": "Folding fan mounted as an album leaf; ink and color on gold paper",
 "dimensions": "8 x 22 in. (20.3 x 55.9 cm)",
 "excavated_from": "",
 "collection": {
  "museum": "大都会艺术博物馆",
  "region": "北美洲",
  "inventory_no": "1989.363.126"
 },
 "summary": "Folding fan mounted as an album leaf。China。Ming dynasty (1368–1644)",
 "history": "",
 "interpretation": [],
 "images": [
  {
   "url": "https://images.metmuseum.org/CRDImages/as/original/DP153876.jpg",
   "license": "CC0",
   "credit": "The Metropolitan Museum of Art, CC0"
  }
 ],
 "source_url": "https://www.metmuseum.org/art/collection/search/49055",
 "license": "CC0",
 "tags": [
  "山水"
 ],
 "related": [],
 "raw_ref": "raw/met/49055.json",
 "needs_review": false,
 "fetched_at": "2026-09-08",
 "updated_at": "2026-09-08"
}