{
 "relic_id": "MET-70109",
 "name": "Rank Badge with Waves and Rocks",
 "aliases": [],
 "dynasty": "清",
 "dynasty_confidence": "medium",
 "year_range": [
  1867,
  1933
 ],
 "category": "杂器",
 "material": "Silk, metallic thread",
 "dimensions": "9 x 9 1/2 in. (22.86 x 24.13 cm)",
 "excavated_from": "",
 "collection": {
  "museum": "大都会艺术博物馆",
  "region": "北美洲",
  "inventory_no": "55.157.4"
 },
 "summary": "Rank Badge。China。Qing dynasty (1644–1911)",
 "history": "",
 "interpretation": [],
 "images": [
  {
   "url": "https://images.metmuseum.org/CRDImages/as/original/160084.jpg",
   "license": "CC0",
   "credit": "The Metropolitan Museum of Art, CC0"
  }
 ],
 "source_url": "https://www.metmuseum.org/art/collection/search/70109",
 "license": "CC0",
 "tags": [
  "官僚制度",
  "山水"
 ],
 "related": [],
 "raw_ref": "raw/met/70109.json",
 "needs_review": false,
 "fetched_at": "2026-09-08",
 "updated_at": "2026-09-08"
}