{
 "relic_id": "MET-62087",
 "name": "Shellac Specimen for Jade Carving",
 "aliases": [],
 "dynasty": "不详",
 "dynasty_confidence": "low",
 "year_range": [
  1900,
  1999
 ],
 "category": "杂器",
 "material": "Shellac",
 "dimensions": "H. 1/8 in. (0.3 cm); W. 3/4 in. (1.9 cm); L. 1 3/8 in. (3.5 cm)",
 "excavated_from": "",
 "collection": {
  "museum": "大都会艺术博物馆",
  "region": "北美洲",
  "inventory_no": "1981.296.35"
 },
 "summary": "Jade carving material。China",
 "history": "",
 "interpretation": [],
 "images": [
  {
   "url": "https://images.metmuseum.org/CRDImages/as/original/1981_296_35_O1.jpg",
   "license": "CC0",
   "credit": "The Metropolitan Museum of Art, CC0"
  }
 ],
 "source_url": "https://www.metmuseum.org/art/collection/search/62087",
 "license": "CC0",
 "tags": [
  "手工业"
 ],
 "related": [],
 "raw_ref": "raw/met/62087.json",
 "needs_review": false,
 "fetched_at": "2026-09-08",
 "updated_at": "2026-09-26"
}