{
 "relic_id": "MET-36027",
 "name": "Landscape After Wang Meng",
 "aliases": [],
 "dynasty": "清",
 "dynasty_confidence": "medium",
 "year_range": [
  1759,
  1759
 ],
 "category": "杂器",
 "material": "Hanging scroll; ink and color on paper",
 "dimensions": "49 x 15 31/32 in. (124.5 x 40.6 cm)",
 "excavated_from": "",
 "collection": {
  "museum": "大都会艺术博物馆",
  "region": "北美洲",
  "inventory_no": "13.220.123"
 },
 "summary": "Hanging scroll。China。Qing dynasty (1644–1911)",
 "history": "",
 "interpretation": [],
 "images": [
  {
   "url": "https://images.metmuseum.org/CRDImages/as/original/13_220_123_O1_sf.jpg",
   "license": "CC0",
   "credit": "The Metropolitan Museum of Art, CC0"
  }
 ],
 "source_url": "https://www.metmuseum.org/art/collection/search/36027",
 "license": "CC0",
 "tags": [
  "山水"
 ],
 "related": [],
 "raw_ref": "raw/met/36027.json",
 "needs_review": false,
 "fetched_at": "2026-09-08",
 "updated_at": "2026-09-08"
}