{
 "relic_id": "CLE-1957-60",
 "name": "Stem Cup",
 "aliases": [],
 "dynasty": "明",
 "dynasty_confidence": "high",
 "year_range": [
  1426,
  1435
 ],
 "category": "瓷器",
 "material": "porcelain with underglaze blue and overglaze red enamel decoration",
 "dimensions": "Overall: 9 x 9.9 cm (3 9/16 x 3 7/8 in.)",
 "excavated_from": "",
 "collection": {
  "museum": "克利夫兰艺术博物馆",
  "region": "北美洲",
  "inventory_no": "1957.60"
 },
 "summary": "These two Ming imperial wares [CMA 1957.60 and CMA 1957.61] are among the smallest, but most precious, of the museum's holdings in Chinese ceramics. The luminous glaze, gestural freedom, and vibrant color are perfectly unified to fit the delicate shapes of these luxury items.",
 "history": "",
 "interpretation": [],
 "images": [
  {
   "url": "https://openaccess-cdn.clevelandart.org/1957.60/1957.60_web.jpg",
   "license": "CC0",
   "credit": "The Cleveland Museum of Art, CC0"
  },
  {
   "url": "https://openaccess-cdn.clevelandart.org/1957.60/1957.60_print.jpg",
   "license": "CC0",
   "credit": "The Cleveland Museum of Art, CC0"
  },
  {
   "url": "https://openaccess-cdn.clevelandart.org/1957.60/1957.60_alt0_web.jpg",
   "license": "CC0",
   "credit": "The Cleveland Museum of Art, CC0"
  },
  {
   "url": "https://openaccess-cdn.clevelandart.org/1957.60/1957.60_alt1_web.jpg",
   "license": "CC0",
   "credit": "The Cleveland Museum of Art, CC0"
  }
 ],
 "source_url": "https://clevelandart.org/art/1957.60",
 "license": "CC0",
 "tags": [
  "食器",
  "酒文化",
  "礼制",
  "动物"
 ],
 "related": [],
 "raw_ref": "raw/cle/page_1000.json",
 "needs_review": false,
 "fetched_at": "2026-09-04",
 "updated_at": "2026-09-04"
}