{
 "relic_id": "MET-70996",
 "name": "Textile fragment with cloud palmettes and characters of longevity (Shou)",
 "aliases": [],
 "dynasty": "元",
 "dynasty_confidence": "medium",
 "year_range": [
  1300,
  1368
 ],
 "category": "杂器",
 "material": "Silk satin damask",
 "dimensions": "11 × 8 3/8 in. (27.9 × 21.3 cm)\r\nMount: 15 × 12 × 1 3/8 in. (38.1 × 30.5 × 3.5 cm)",
 "excavated_from": "",
 "collection": {
  "museum": "大都会艺术博物馆",
  "region": "北美洲",
  "inventory_no": "46.156.20"
 },
 "summary": "Fragment。China。Yuan dynasty (1271–1368)",
 "history": "",
 "interpretation": [],
 "images": [
  {
   "url": "https://images.metmuseum.org/CRDImages/as/original/DP222033.jpg",
   "license": "CC0",
   "credit": "The Metropolitan Museum of Art, CC0"
  }
 ],
 "source_url": "https://www.metmuseum.org/art/collection/search/70996",
 "license": "CC0",
 "tags": [
  "服饰"
 ],
 "related": [],
 "raw_ref": "raw/met/70996.json",
 "needs_review": false,
 "fetched_at": "2026-09-08",
 "updated_at": "2026-09-08"
}