{
 "relic_id": "SXHM-七五160",
 "name": "春秋空首布铜钱",
 "aliases": [
  "空首布"
 ],
 "dynasty": "春秋",
 "year_range": [
  -770,
  -476
 ],
 "category": "钱币",
 "material": "铜",
 "dimensions": "长10,宽5.4",
 "excavated_from": "",
 "collection": {
  "museum": "陕西历史博物馆",
  "region": "中国大陆",
  "inventory_no": "七五160"
 },
 "summary": "春秋空首布铜钱，东周时期。陕西历史博物馆藏中国历代钱币。馆方公开目录中该名称品种共登记 5 件，本条为同名称品种汇总记录（代表藏品编号 七五160）。",
 "history": "",
 "interpretation": [],
 "images": [],
 "source_url": "https://www.sxhm.com/down/news/499.html",
 "license": "©陕西历史博物馆",
 "tags": [],
 "related": [],
 "raw_ref": "raw/sxhm/499.xlsx",
 "needs_review": false,
 "fetched_at": "2026-09-21",
 "updated_at": "2026-09-23"
}
