{
 "relic_id": "CLE-1979-76",
 "name": "Snow Coloring the World White",
 "aliases": [],
 "dynasty": "清",
 "dynasty_confidence": "high",
 "year_range": [
  1690,
  1690
 ],
 "category": "书画",
 "material": "handscroll; ink on paper",
 "dimensions": "Image: 29.3 x 297.2 cm (11 9/16 x 117 in.)",
 "excavated_from": "",
 "collection": {
  "museum": "克利夫兰艺术博物馆",
  "region": "北美洲",
  "inventory_no": "1979.76"
 },
 "summary": "Fa Ruozhen was a scholar-official and prolific poet who focused on painting as his government career declined. The inscription records that he was 78 years old when he painted this handscroll to welcome visitors on a snowy day. At this point in his artistic development, Fa created expressive landsca",
 "history": "",
 "interpretation": [],
 "images": [
  {
   "url": "https://openaccess-cdn.clevelandart.org/1979.76/1979.76_web.jpg",
   "license": "CC0",
   "credit": "The Cleveland Museum of Art, CC0"
  },
  {
   "url": "https://openaccess-cdn.clevelandart.org/1979.76/1979.76_print.jpg",
   "license": "CC0",
   "credit": "The Cleveland Museum of Art, CC0"
  },
  {
   "url": "https://openaccess-cdn.clevelandart.org/1979.76/1979.76_alt0_web.jpg",
   "license": "CC0",
   "credit": "The Cleveland Museum of Art, CC0"
  },
  {
   "url": "https://openaccess-cdn.clevelandart.org/1979.76/1979.76_alt1_web.jpg",
   "license": "CC0",
   "credit": "The Cleveland Museum of Art, CC0"
  }
 ],
 "source_url": "https://clevelandart.org/art/1979.76",
 "license": "CC0",
 "tags": [
  "酒文化",
  "礼制"
 ],
 "related": [],
 "raw_ref": "raw/cle/page_0.json",
 "needs_review": false,
 "fetched_at": "2026-09-04",
 "updated_at": "2026-09-04"
}