{
 "relic_id": "MET-44393",
 "name": "Standing Farmer holding a Pitchfork",
 "aliases": [],
 "dynasty": "汉",
 "dynasty_confidence": "medium",
 "year_range": [
  1,
  199
 ],
 "category": "陶器",
 "material": "Earthenware with green lead glaze",
 "dimensions": "H. 10 1/2 in. (26.7 cm)",
 "excavated_from": "",
 "collection": {
  "museum": "大都会艺术博物馆",
  "region": "北美洲",
  "inventory_no": "1994.605.93"
 },
 "summary": "Figure。China。Eastern Han dynasty (25–220)",
 "history": "",
 "interpretation": [],
 "images": [
  {
   "url": "https://images.metmuseum.org/CRDImages/as/original/DP-46743-001.jpg",
   "license": "CC0",
   "credit": "The Metropolitan Museum of Art, CC0"
  }
 ],
 "source_url": "https://www.metmuseum.org/art/collection/search/44393",
 "license": "CC0",
 "tags": [
  "家具"
 ],
 "related": [],
 "raw_ref": "raw/met/44393.json",
 "needs_review": false,
 "fetched_at": "2026-09-08",
 "updated_at": "2026-09-08"
}