{
 "relic_id": "MET-39623",
 "name": "Disk with dragons",
 "aliases": [],
 "dynasty": "元",
 "dynasty_confidence": "low",
 "year_range": [
  1300,
  1433
 ],
 "category": "竹木牙角",
 "material": "Ivory",
 "dimensions": "H. 10 1/8 in. (25.7 cm); Diam. 4 9/16 in. (11.6 cm)",
 "excavated_from": "",
 "collection": {
  "museum": "大都会艺术博物馆",
  "region": "北美洲",
  "inventory_no": "19.190a, b"
 },
 "summary": "Disk。China。Late Yuan (1271–1368) or early Ming (1368–1644) dynasty)",
 "history": "",
 "interpretation": [],
 "images": [
  {
   "url": "https://images.metmuseum.org/CRDImages/as/original/DP310102.jpg",
   "license": "CC0",
   "credit": "The Metropolitan Museum of Art, CC0"
  }
 ],
 "source_url": "https://www.metmuseum.org/art/collection/search/39623",
 "license": "CC0",
 "tags": [
  "祥瑞纹样",
  "动物"
 ],
 "related": [],
 "raw_ref": "raw/met/39623.json",
 "needs_review": true,
 "fetched_at": "2026-09-08",
 "updated_at": "2026-09-23"
}
