{
 "relic_id": "MET-37368",
 "name": "Kabuki Actor Ichikawa Ebizō (Ichikawa Danjūrō V) in the play The Colored Reins of a Loving Wife (Koi nyōbō somewake tazuna)",
 "aliases": [],
 "dynasty": "清",
 "dynasty_confidence": "medium",
 "year_range": [
  1794,
  1794
 ],
 "category": "竹木牙角",
 "material": "Woodblock print; ink and color on paper with mica ground",
 "dimensions": "14 15/32 x 9 3/5 in. (36.8 x 24.4 cm)",
 "excavated_from": "",
 "collection": {
  "museum": "大都会艺术博物馆",
  "region": "北美洲",
  "inventory_no": "JP3114"
 },
 "summary": "Print。Japan。Edo period (1615–1868)",
 "history": "",
 "interpretation": [],
 "images": [
  {
   "url": "https://images.metmuseum.org/CRDImages/as/original/DP130194.jpg",
   "license": "CC0",
   "credit": "The Metropolitan Museum of Art, CC0"
  }
 ],
 "source_url": "https://www.metmuseum.org/art/collection/search/37368",
 "license": "CC0",
 "tags": [
  "酒文化",
  "礼制"
 ],
 "related": [],
 "raw_ref": "raw/met/37368.json",
 "needs_review": false,
 "fetched_at": "2026-09-04",
 "updated_at": "2026-09-04"
}