{
 "relic_id": "MET-48949",
 "name": "Shaded Dwellings among Streams and Mountains",
 "aliases": [],
 "dynasty": "明",
 "dynasty_confidence": "medium",
 "year_range": [
  1612,
  1635
 ],
 "category": "杂器",
 "material": "Hanging scroll; ink on paper",
 "dimensions": "Image: 62 3/8 x 28 3/8 in. (158.4 x 72.1 cm)\r\nOverall with mounting: 99 x 33 1/8 in. (251.5 x 84.1 cm)\r\nOverall with knobs: 99 x 37 in. (251.5 x 94 cm)",
 "excavated_from": "",
 "collection": {
  "museum": "大都会艺术博物馆",
  "region": "北美洲",
  "inventory_no": "1979.75.2"
 },
 "summary": "Hanging scroll。China。Ming dynasty (1368–1644)",
 "history": "",
 "interpretation": [],
 "images": [
  {
   "url": "https://images.metmuseum.org/CRDImages/as/original/DP-13850-002.jpg",
   "license": "CC0",
   "credit": "The Metropolitan Museum of Art, CC0"
  }
 ],
 "source_url": "https://www.metmuseum.org/art/collection/search/48949",
 "license": "CC0",
 "tags": [
  "山水"
 ],
 "related": [],
 "raw_ref": "raw/met/48949.json",
 "needs_review": false,
 "fetched_at": "2026-09-08",
 "updated_at": "2026-09-08"
}