{
 "relic_id": "SMI-fsg_F1913.153",
 "name": "Chair cover with a crane, lions, dragons, auspicious symbols and floral patterns",
 "aliases": [],
 "dynasty": "清",
 "dynasty_confidence": "high",
 "year_range": [
  1701,
  1800
 ],
 "category": "织绣",
 "material": "Brocade (jin): woven silk and metal-wrapped threads | H x W: 17.8 x 57 cm (7 x 22 7/16 in)",
 "dimensions": "Brocade (jin): woven silk and metal-wrapped threads | H x W: 17.8 x 57 cm (7 x 22 7/16 in)",
 "excavated_from": "",
 "summary": "18th century ， Qing dynasty。Brocade (jin): woven silk and metal-wrapped threads | H x W: 17.8 x 57 cm (7 x 22 7/16 in)",
 "history": "",
 "interpretation": [],
 "collection": {
  "museum": "史密森尼国家亚洲艺术博物馆",
  "region": "北美洲",
  "inventory_no": "F1913.153"
 },
 "images": [
  {
   "url": "https://ids.si.edu/ids/deliveryService?id=FS-7258_16",
   "license": "CC0",
   "credit": "National Museum of Asian Art, Smithsonian Institution"
  }
 ],
 "source_url": "https://asia.si.edu/object/F1913.153/",
 "license": "CC0",
 "tags": [
  "祥瑞纹样",
  "动物",
  "植物",
  "服饰",
  "家具"
 ],
 "related": [],
 "raw_ref": "raw/smi/search_*.json",
 "needs_review": false,
 "fetched_at": "2026-09-24",
 "updated_at": "2026-09-24"
}